{
  "title": "Webinar @ VAIA - Flanders AI EDIH Transfer Learning Talk",
  "date": "2025/10/22",
  "link": "https://events.teams.microsoft.com/event/c5a675b4-3d13-474d-b1f9-484d6d720e08@a72d5a72-25ee-40f0-9bd1-067cb5b770d4",
  "image": "saja.png",
  "description": "From Experience to Expertise: An Introduction to Transfer Learning"
}
