{
  "title": "Webinar@Dataset Distillation - A Gentle Introduction",
  "date": "2025/07/15",
  "link": "https://www.vaia.be/en/courses/dataset-distillation-a-gentle-introduction",
  "image": "benjamin.jpg",
  "description": "Get familiar with the standard dataset distillation techniques, and gain familiarity with uses cases that could benefit from it."
}
