{
  "title": "Webinar @ VAIA - Flanders AI EDIH Self-Supervised Learning Talk",
  "date": "2025/11/27",
  "link": "https://events.teams.microsoft.com/event/0e1ccef1-fae3-4ea4-a1c6-e8771b7cad3e@a72d5a72-25ee-40f0-9bd1-067cb5b770d4",
  "image": "saja.png",
  "description": "Self-Supervised Learning: Training AI Models with Less Labels"
}