[

  {
    "title": "Talk @ Kekule Cycle XXI",
    "date": "14 Oct 2025",
    "link": "https://www.kvcv.be/nl/activiteiten-en-nieuws/kalender/676-quid-quantum-and-ai",
    "image": "people/jose.png",
    "description": "An accessible introduction to representation learning and interpretability"
  },


  {
    "title": "Webinar @ VAIA - Flanders AI EDIH HSI Talk",
    "date": "29 Sep 2025",
    "link": "publications/_example",
    "image": "people/salma.jpg",
    "description": "Hyperspectral Imaging and Machine Learning: Decoding the Spectrum for Advanced Data Analysis"
  },
  {
    "title": "Talk @ VisAPP'24",
    "date": "27 Feb 2025",
    "link": "publications/_example",
    "image": "people/benjamin.jpg",
    "description": "Recognizing actions in high-resolution low-framerate videos: a feasibility study in the construction sector."
  },
  {
    "title": "Talk @ ACRAI Research Day",
    "date": "21 Feb 2025",
    "link": "publications/_example",
    "image": "people/salma.jpg",
    "description": "Explainability-Driven Dimensionality Reduction for Hyperspectral Imaging"
  },
  {
    "title": "Talk @ Flanders AI Day",
    "date": "14 Oct 2024",
    "link": "https://docs.google.com/presentation/d/1PdcHm0bgwIu3yhy6oWkwL1-fDGTPzTiyUilydognLlw/edit?usp=sharing",
    "image": "people/thomas.jpg",
    "description": "A swift introduction to weight-based interpretability."
  },
  {
    "title": "Talk @ BeCode",
    "date": "Oct 2024",
    "link": "publications/_example",
    "image": "people/saja.png",
    "description": "General presentation about explainability"
  },
  {
    "title": "Talk @ Women in Data Science (WiDS)",
    "date": "Mar 2024",
    "link": "publications/_example",
    "image": "people/saja.png",
    "description": "Analyzing Representations Learned via Capsule Neural Networks. A systematic and principled study towards assessing the interpretability of Capsule networks"
  },
  {
    "title": "Talk @ Clusity",
    "date": "June 2023",
    "link": "publications/_example",
    "image": "people/saja.png",
    "description": "General presentation about explainability"
  }

]
