{
  "title": "Talk@Flanders AI Day - Workshop on Advances in Responsible AI",
  "date": "2023/10/16",
  "link": "https://www.flandersairesearch.be/en/research/research-day",
  "image": "benjamin.jpg",
  "description": "Presentation on coherence between different evaluation metrics for visual explanations."
}
