{
  "title": "Talk @ Women in Data Science (WiDS)",
  "date": "2024/03/01",
  "link": "https://www.widsconference.org/",
  "image": "saja.png",
  "description": "Analyzing Representations Learned via Capsule Neural Networks. A systematic and principled study towards assessing the interpretability of Capsule networks"
}
